Post date,Title,Comment count,Word count
31 Jan 2017,Book review: Ours to Hack and to Own,0,660
31 Jan 2017,5 new guides for working with OpenStack,2,419
31 Jan 2017,Be the open source supply chain,1,1668
31 Jan 2017,Developing open leaders,1,768
30 Jan 2017,How to get up and running with sweet Orange Pi,12,933
30 Jan 2017,4 ways to improve your security online right now,3,1242
30 Jan 2017, WOOTConf 2017: Lockpicking, Willie Nelson developers, and more,1,844
30 Jan 2017,From hobbyist to professional, new analyst papers, and more OpenStack news,0,327
28 Jan 2017,How communities in India support privacy and software freedom,0,453
28 Jan 2017,New Minecraft launcher comes to Linux, Tilt Brush Toolkit, and more open gaming news,0,359
27 Jan 2017,Top 5: Solid state drives in Linux, Brotli compression algorithm, and more,0,216
27 Jan 2017,Data Privacy Day 2017: Solutions for everyday privacy,5,1424
27 Jan 2017,How to successfully enter the FOSS emerging market,0,915
27 Jan 2017,Getting started with my new LulzBot Mini 3D printer,2,1390
26 Jan 2017,A 5-step plan to encourage your team to make changes on your project,5,1160
26 Jan 2017,Search this database for inactive patents that are now in the public domain,0,641
26 Jan 2017,Using rsync to back up your Linux system,19,1838
26 Jan 2017,How to join a technical community,1,640
25 Jan 2017,Solid state drives in Linux: Enabling TRIM for SSDs,19,573
25 Jan 2017,An executive's guide to containers,4,2032
25 Jan 2017,24 Pull Requests challenge encourages fruitful contributions,0,429
25 Jan 2017,Happy birthday to Opensource.com: 7 years of open source,11,244
25 Jan 2017,Announcing the 2016 Open Source Yearbook: Download now,0,58
24 Jan 2017,Brotli: A new compression algorithm for faster Internet,12,590
24 Jan 2017,School systems desperate for standards-aligned curricula find hope,0,1151
24 Jan 2017,What your code repository says about you,1,1085
23 Jan 2017,Unpicking the community leader,0,701
23 Jan 2017,Win a LulzBot Mini 3D printer in our giveaway,1,196
23 Jan 2017,Shell scripting: An introduction to the shift method and custom functions,4,1449
23 Jan 2017,Python and successive approximation,7,347
23 Jan 2017,2017 People's Choice Awards: Cast your vote,3,562
23 Jan 2017,Tips for instance configuration, creating a new project, and more OpenStack news,0,395
21 Jan 2017,The new Raspberry Pi Compute Module, FSF's 2017 priorities, and more open source news,0,443
20 Jan 2017,5 ways to expand your project's contributor base,2,690
20 Jan 2017,How to write web apps in R with Shiny,2,218
20 Jan 2017,Top 5: Shell scripting, the Cinnamon Linux desktop environment, and more,0,214
20 Jan 2017,How is your community promoting diversity?,1,1007
19 Jan 2017,Get to know Tuleap for project management,0,672
19 Jan 2017,How to get started contributing to Mozilla,2,1241
19 Jan 2017,Be a force for good in your community,2,1516
18 Jan 2017,Do I need to provide access to source code under the AGPLv3 license?,9,348
18 Jan 2017,10 reasons to use Cinnamon as your Linux desktop environment,14,1296
18 Jan 2017,How to gain confidence to participate in open source,4,1108
17 Jan 2017,A behind the scenes look at Exercism for improving coding skills,1,2923
17 Jan 2017,What is your favorite Linux distribution?,174,278
17 Jan 2017,Why events matter and how to do them right,2,895
17 Jan 2017,5 resolutions to become a more open leader in 2017,2,1019
16 Jan 2017, Cast your vote: 2017 Reader's Choice and Best Interview Awards,0,357
16 Jan 2017,Can academic faculty members teach with Wikipedia?,5,1032
16 Jan 2017,Why every business should consider an open source point of sale system,3,654
16 Jan 2017,Getting started with shell scripting,6,1990
16 Jan 2017,Tips for contributors, managing containers at CERN, and more OpenStack news,0,300
14 Jan 2017,Discord chat and VOIP on Linux, game streaming on any device, and more,0,394
13 Jan 2017,Top 5: Most common Linux issues, Exercism for programming skills, and more,0,196
13 Jan 2017,Tips for non-native English speakers working on open source projects,1,786
13 Jan 2017,3 open source music players: Aqualung, Lollypop, and GogglesMM,6,1606
13 Jan 2017,How companies can help employees contribute to open source,4,655
12 Jan 2017,3 to-do list managers for the Linux command line,5,780
12 Jan 2017,How to use Pulse to manage sound on Linux,0,1798
12 Jan 2017,My first three contributions to open source,1,618
12 Jan 2017,Proof that openness scales,0,1039
11 Jan 2017,How to choose your first programming language,5,1291
11 Jan 2017,Explore climate data with open source tools,2,425
11 Jan 2017,The difference between development and deployment,2,1189
10 Jan 2017,Improve your programming skills with Exercism ,1,661
10 Jan 2017,Open medical records community supports new system in Mozambique,0,1219
10 Jan 2017,Why we need an open model to design and evaluate public policy,1,805
10 Jan 2017,What engineers and marketers can learn from each other,0,1169
09 Jan 2017,How to get started as an open source programmer,8,1885
09 Jan 2017,Troubleshooting tips for the 5 most common Linux issues,18,794
09 Jan 2017,Open technology for land rights documentation,0,792
09 Jan 2017,Landing a job, becoming the de facto private cloud, and more OpenStack news,0,390
07 Jan 2017,CyanogenMod's death and rebirth, new open source automotive group, and more news,0,494
06 Jan 2017,Top 5: Hot programming trends, How Linux got to be Linux, and more,0,241
06 Jan 2017,Publisher's picks: Top 2016 open source books ,0,2034
06 Jan 2017,Using Clang-format to ensure clean, consistent code,5,627
06 Jan 2017,Top 10 and editor's picks: December review,0,260
05 Jan 2017,10 open source task management and time tracking applications for Android,0,1064
05 Jan 2017,10 steps to innersource in your organization in 2017,5,1753
05 Jan 2017,9 reasons to certify your products as open source hardware,1,400
05 Jan 2017,What storytellers can teach open leaders,2,508
04 Jan 2017,50 ways to avoid getting hacked in 2017,14,2143
04 Jan 2017,By Jove! It's a lightweight alternative to Vim,14,1346
04 Jan 2017,DronePan: An app that captures panorama views with your aircraft,2,533
03 Jan 2017,4 hot skills for Linux pros in 2017,10,708
03 Jan 2017,What does cross stitch have to do with programming? More than you think,5,1997
03 Jan 2017,Tapitoo OpenCart: An open source e-commerce mobile app,1,1127
03 Jan 2017,Avoid echo chambers and make open decisions,1,723
02 Jan 2017,7 notable legal developments in open source in 2016,3,2359
02 Jan 2017,3 tips for effectively using wikis for documentation,1,710
02 Jan 2017,The Opensource.com preview for January,0,358
02 Jan 2017,What is your open source New Year's resolution?,1,186
